{
  "$schema": "../../schema/authority.schema.json",
  "id": "ifza",
  "version": 1,
  "updated": "2026-09-28",
  "submissionChannel": {
    "type": "partner-only",
    "note": "Licensees apply through IFZA-registered partners on the Partner Portal; no direct licensee login confirmed.",
    "source": "IFZA renewal guide",
    "grade": "confirmed"
  },
  "leaseAtRenewal": {
    "text": "No official rule found on lease validity at renewal.",
    "grade": "unknown",
    "whoCanAnswer": "the zone"
  },
  "renewalWindow": {
    "text": "The licence must be renewed on or before the expiry date. No official advance window found.",
    "source": "IFZA renewal guide",
    "grade": "confirmed"
  },
  "renewsTogether": [
    {
      "item": "Financial statements are submitted with the renewal; a three-month preparation period after financial year-end is allowed.",
      "source": "IFZA renewal guide",
      "grade": "confirmed"
    }
  ],
  "ifLate": {
    "text": "An expired licence cannot be used to trade, banks may suspend accounts, and fines may be imposed. If not renewed, the licence may be struck off and visas may be cancelled or marked absconding. Amendments cannot be made on an expired licence. A grace period exists but its length is not stated.",
    "source": "IFZA renewal guide; IFZA missed-renewal article",
    "grade": "confirmed"
  },
  "prefill": {
    "visaQuotaByOfficeType": []
  },
  "sources": [
    "ifza.com/wp-content/uploads/2024/03/how-to-renew-your-general-licence.pdf",
    "cdn.ifza.com/marketing/FAQs Update_.pdf",
    "ifza.com/en/missed-trade-license-renewal-uae/"
  ]
}
